{
  "application_version": "0.0.2",
  "backend": {
    "backend_kind": "audiocpp",
    "effective_runtime": "default",
    "fallback_used": false,
    "placement_evidence": "audio.cpp created explicit CPU Silero and ASR sessions",
    "placement_verified": true,
    "requested_device": "cpu",
    "requested_runtime": "default"
  },
  "evaluation": "omawake-phrase-verifier-accuracy",
  "files": [
    {
      "audio_duration_milliseconds": 6625.0,
      "counts": {
        "duplicate_predictions": 0,
        "false_negatives": 0,
        "false_positives": 0,
        "true_positives": 1,
        "wrong_id_predictions": 0
      },
      "duplicate_prediction_indices": [],
      "elapsed_milliseconds": 713.195643,
      "expected": [
        {
          "end_ms": null,
          "keyword_id": "light-up",
          "start_ms": null
        }
      ],
      "id": "1089-134686-0002-clean",
      "matches": [
        {
          "end_error_ms": null,
          "expected_index": 0,
          "keyword_id": "light-up",
          "prediction_index": 0
        }
      ],
      "path": "1089-134686-0002-clean.wav",
      "predictions": [
        {
          "keyword_id": "light-up",
          "observed_end_ms": 65.99999964237213,
          "observed_start_ms": 65.99999964237213,
          "timestamps": [],
          "tokens": [
            "light",
            "up"
          ]
        }
      ],
      "real_time_factor": 0.10765217252830188,
      "split": "clean",
      "tags": {
        "ground_truth": "reference-transcript",
        "kind": "generated-corruption-not-real-room",
        "recipe": "clean",
        "source_sha256": "dfb54074469700446b889a622230fb6d918a19f3e6cb90afeb62d0ec98651c01"
      },
      "wrong_id_prediction_indices": []
    },
    {
      "audio_duration_milliseconds": 6625.0,
      "counts": {
        "duplicate_predictions": 0,
        "false_negatives": 0,
        "false_positives": 0,
        "true_positives": 1,
        "wrong_id_predictions": 0
      },
      "duplicate_prediction_indices": [],
      "elapsed_milliseconds": 694.649221,
      "expected": [
        {
          "end_ms": null,
          "keyword_id": "light-up",
          "start_ms": null
        }
      ],
      "id": "1089-134686-0002-white-noise-10db",
      "matches": [
        {
          "end_error_ms": null,
          "expected_index": 0,
          "keyword_id": "light-up",
          "prediction_index": 0
        }
      ],
      "path": "1089-134686-0002-white-noise-10db.wav",
      "predictions": [
        {
          "keyword_id": "light-up",
          "observed_end_ms": 34.00000184774399,
          "observed_start_ms": 34.00000184774399,
          "timestamps": [],
          "tokens": [
            "light",
            "up"
          ]
        }
      ],
      "real_time_factor": 0.1048527126037736,
      "split": "white-noise-10db",
      "tags": {
        "ground_truth": "reference-transcript",
        "kind": "generated-corruption-not-real-room",
        "recipe": "white-noise-10db",
        "source_sha256": "dfb54074469700446b889a622230fb6d918a19f3e6cb90afeb62d0ec98651c01"
      },
      "wrong_id_prediction_indices": []
    },
    {
      "audio_duration_milliseconds": 6625.0,
      "counts": {
        "duplicate_predictions": 0,
        "false_negatives": 0,
        "false_positives": 0,
        "true_positives": 1,
        "wrong_id_predictions": 0
      },
      "duplicate_prediction_indices": [],
      "elapsed_milliseconds": 705.581022,
      "expected": [
        {
          "end_ms": null,
          "keyword_id": "light-up",
          "start_ms": null
        }
      ],
      "id": "1089-134686-0002-white-noise-0db",
      "matches": [
        {
          "end_error_ms": null,
          "expected_index": 0,
          "keyword_id": "light-up",
          "prediction_index": 0
        }
      ],
      "path": "1089-134686-0002-white-noise-0db.wav",
      "predictions": [
        {
          "keyword_id": "light-up",
          "observed_end_ms": 65.99999964237213,
          "observed_start_ms": 65.99999964237213,
          "timestamps": [],
          "tokens": [
            "light",
            "up"
          ]
        }
      ],
      "real_time_factor": 0.1065027957735849,
      "split": "white-noise-0db",
      "tags": {
        "ground_truth": "reference-transcript",
        "kind": "generated-corruption-not-real-room",
        "recipe": "white-noise-0db",
        "source_sha256": "dfb54074469700446b889a622230fb6d918a19f3e6cb90afeb62d0ec98651c01"
      },
      "wrong_id_prediction_indices": []
    },
    {
      "audio_duration_milliseconds": 6865.0,
      "counts": {
        "duplicate_predictions": 0,
        "false_negatives": 0,
        "false_positives": 0,
        "true_positives": 1,
        "wrong_id_predictions": 0
      },
      "duplicate_prediction_indices": [],
      "elapsed_milliseconds": 714.457537,
      "expected": [
        {
          "end_ms": null,
          "keyword_id": "light-up",
          "start_ms": null
        }
      ],
      "id": "1089-134686-0002-echo-120-240ms",
      "matches": [
        {
          "end_error_ms": null,
          "expected_index": 0,
          "keyword_id": "light-up",
          "prediction_index": 0
        }
      ],
      "path": "1089-134686-0002-echo-120-240ms.wav",
      "predictions": [
        {
          "keyword_id": "light-up",
          "observed_end_ms": 65.99999964237213,
          "observed_start_ms": 65.99999964237213,
          "timestamps": [],
          "tokens": [
            "light",
            "up"
          ]
        }
      ],
      "real_time_factor": 0.1040724744355426,
      "split": "echo-120-240ms",
      "tags": {
        "ground_truth": "reference-transcript",
        "kind": "generated-corruption-not-real-room",
        "recipe": "echo-120-240ms",
        "source_sha256": "dfb54074469700446b889a622230fb6d918a19f3e6cb90afeb62d0ec98651c01"
      },
      "wrong_id_prediction_indices": []
    },
    {
      "audio_duration_milliseconds": 16715.0,
      "counts": {
        "duplicate_predictions": 0,
        "false_negatives": 0,
        "false_positives": 0,
        "true_positives": 2,
        "wrong_id_predictions": 0
      },
      "duplicate_prediction_indices": [],
      "elapsed_milliseconds": 1837.705769,
      "expected": [
        {
          "end_ms": null,
          "keyword_id": "lovely-child",
          "start_ms": null
        },
        {
          "end_ms": null,
          "keyword_id": "forever",
          "start_ms": null
        }
      ],
      "id": "1221-135766-0001-clean",
      "matches": [
        {
          "end_error_ms": null,
          "expected_index": 0,
          "keyword_id": "lovely-child",
          "prediction_index": 0
        },
        {
          "end_error_ms": null,
          "expected_index": 1,
          "keyword_id": "forever",
          "prediction_index": 1
        }
      ],
      "path": "1221-135766-0001-clean.wav",
      "predictions": [
        {
          "keyword_id": "lovely-child",
          "observed_end_ms": 2.0000000949949026,
          "observed_start_ms": 2.0000000949949026,
          "timestamps": [],
          "tokens": [
            "lovely",
            "child"
          ]
        },
        {
          "keyword_id": "forever",
          "observed_end_ms": 2.0000000949949026,
          "observed_start_ms": 2.0000000949949026,
          "timestamps": [],
          "tokens": [
            "forever"
          ]
        }
      ],
      "real_time_factor": 0.10994350996111278,
      "split": "clean",
      "tags": {
        "ground_truth": "reference-transcript",
        "kind": "generated-corruption-not-real-room",
        "recipe": "clean",
        "source_sha256": "19cfcf141db2f71de563525ed0a9b673f6aa51208e974f9c765a159789cddc2c"
      },
      "wrong_id_prediction_indices": []
    },
    {
      "audio_duration_milliseconds": 16715.0,
      "counts": {
        "duplicate_predictions": 0,
        "false_negatives": 0,
        "false_positives": 0,
        "true_positives": 2,
        "wrong_id_predictions": 0
      },
      "duplicate_prediction_indices": [],
      "elapsed_milliseconds": 1834.821899,
      "expected": [
        {
          "end_ms": null,
          "keyword_id": "lovely-child",
          "start_ms": null
        },
        {
          "end_ms": null,
          "keyword_id": "forever",
          "start_ms": null
        }
      ],
      "id": "1221-135766-0001-white-noise-10db",
      "matches": [
        {
          "end_error_ms": null,
          "expected_index": 0,
          "keyword_id": "lovely-child",
          "prediction_index": 0
        },
        {
          "end_error_ms": null,
          "expected_index": 1,
          "keyword_id": "forever",
          "prediction_index": 1
        }
      ],
      "path": "1221-135766-0001-white-noise-10db.wav",
      "predictions": [
        {
          "keyword_id": "lovely-child",
          "observed_end_ms": 2.0000000949949026,
          "observed_start_ms": 2.0000000949949026,
          "timestamps": [],
          "tokens": [
            "lovely",
            "child"
          ]
        },
        {
          "keyword_id": "forever",
          "observed_end_ms": 2.0000000949949026,
          "observed_start_ms": 2.0000000949949026,
          "timestamps": [],
          "tokens": [
            "forever"
          ]
        }
      ],
      "real_time_factor": 0.10977097810349984,
      "split": "white-noise-10db",
      "tags": {
        "ground_truth": "reference-transcript",
        "kind": "generated-corruption-not-real-room",
        "recipe": "white-noise-10db",
        "source_sha256": "19cfcf141db2f71de563525ed0a9b673f6aa51208e974f9c765a159789cddc2c"
      },
      "wrong_id_prediction_indices": []
    },
    {
      "audio_duration_milliseconds": 16715.0,
      "counts": {
        "duplicate_predictions": 0,
        "false_negatives": 0,
        "false_positives": 0,